{
  "type": "WalletRegistry",
  "version": 1,
  "derivedAt": "2026-09-05T16:52:38.561Z",
  "wallets": [
    {
      "chain": "base",
      "address": "0x00121415C8Fb78Cac877A38D1674dE1e95EDB820",
      "owner": "org",
      "role": "auxiliary",
      "relations": [],
      "custody": {
        "kind": "env-on-host",
        "host": "bare-cedar-fog",
        "locator": "GOSH_WOULDNT_YOU_KNOW_IT_ANOTHER_EVM_WALLET",
        "reference": null,
        "derivationPath": "m/44'/60'/0'/0/3"
      },
      "custodies": [
        {
          "kind": "env-on-host",
          "host": "bare-cedar-fog",
          "locator": "GOSH_WOULDNT_YOU_KNOW_IT_ANOTHER_EVM_WALLET",
          "reference": null,
          "derivationPath": "m/44'/60'/0'/0/3"
        }
      ],
      "balanceReader": "@red-cup-engineering/treasury-observation-service/native",
      "label": null,
      "sources": [
        {
          "kind": "env-private-key",
          "locator": "GOSH_WOULDNT_YOU_KNOW_IT_ANOTHER_EVM_WALLET"
        }
      ],
      "lastSeen": "2026-09-05T16:52:38.561Z"
    },
    {
      "chain": "base",
      "address": "0x0087497033d33C6eA5DdC8e822C723F4D0A90c29",
      "owner": "org",
      "role": "auxiliary",
      "relations": [],
      "custody": {
        "kind": "env-on-host",
        "host": "bare-cedar-fog",
        "locator": "CLOUDFLARE_R2_BARE_CEDAR_FOG_GIT_LFS_ACCESS_KEY_SECRET",
        "reference": null,
        "derivationPath": null
      },
      "custodies": [
        {
          "kind": "env-on-host",
          "host": "bare-cedar-fog",
          "locator": "CLOUDFLARE_R2_BARE_CEDAR_FOG_GIT_LFS_ACCESS_KEY_SECRET",
          "reference": null,
          "derivationPath": null
        }
      ],
      "balanceReader": "@red-cup-engineering/treasury-observation-service/native",
      "label": null,
      "sources": [
        {
          "kind": "env-private-key",
          "locator": "CLOUDFLARE_R2_BARE_CEDAR_FOG_GIT_LFS_ACCESS_KEY_SECRET"
        }
      ],
      "lastSeen": "2026-09-05T16:52:38.561Z"
    },
    {
      "chain": "base",
      "address": "0x01d207b0a8aAa704c3D815F145709e3F8810dC31",
      "owner": "org",
      "role": "auxiliary",
      "relations": [],
      "custody": {
        "kind": "env-on-host",
        "host": "bare-cedar-fog",
        "locator": "VECHAIN",
        "reference": null,
        "derivationPath": "m/44'/60'/0'/0/4"
      },
      "custodies": [
        {
          "kind": "env-on-host",
          "host": "bare-cedar-fog",
          "locator": "VECHAIN",
          "reference": null,
          "derivationPath": "m/44'/60'/0'/0/4"
        }
      ],
      "balanceReader": "@red-cup-engineering/treasury-observation-service/native",
      "label": null,
      "sources": [
        {
          "kind": "env-private-key",
          "locator": "VECHAIN"
        }
      ],
      "lastSeen": "2026-09-05T16:52:38.561Z"
    },
    {
      "chain": "base",
      "address": "0x01efd40106962297846649bc14a462600D75e5bC",
      "owner": "org",
      "role": "auxiliary",
      "relations": [],
      "custody": {
        "kind": "env-on-host",
        "host": "bare-cedar-fog",
        "locator": "ANOTHER_WALLET",
        "reference": null,
        "derivationPath": "m/44'/60'/0'/0/1"
      },
      "custodies": [
        {
          "kind": "env-on-host",
          "host": "bare-cedar-fog",
          "locator": "ANOTHER_WALLET",
          "reference": null,
          "derivationPath": "m/44'/60'/0'/0/1"
        }
      ],
      "balanceReader": "@red-cup-engineering/treasury-observation-service/native",
      "label": null,
      "sources": [
        {
          "kind": "env-private-key",
          "locator": "ANOTHER_WALLET"
        }
      ],
      "lastSeen": "2026-09-05T16:52:38.561Z"
    },
    {
      "chain": "base",
      "address": "0x0291ff9223b6858fa8940D8fD88e4A7df35A22b7",
      "owner": "founder",
      "role": "auxiliary",
      "relations": [],
      "custody": {
        "kind": "env-on-host",
        "host": "bare-cedar-fog",
        "locator": "MOONSHOT_WALLET",
        "reference": null,
        "derivationPath": "m/44'/60'/0'/0/0"
      },
      "custodies": [
        {
          "kind": "env-on-host",
          "host": "bare-cedar-fog",
          "locator": "MOONSHOT_WALLET",
          "reference": null,
          "derivationPath": "m/44'/60'/0'/0/0"
        },
        {
          "kind": "unknown",
          "host": null,
          "locator": null,
          "reference": null,
          "derivationPath": null
        }
      ],
      "balanceReader": "@red-cup-engineering/treasury-observation-service/native",
      "label": null,
      "sources": [
        {
          "kind": "env-private-key",
          "locator": "MOONSHOT_WALLET"
        },
        {
          "kind": "carrier",
          "locator": "public-web3-services-section/services/agrodao/content/observations/public-accounts/evm-wallet-fleet.json (profile org.emsenn.evm.public-wallet-fleet.v1)"
        }
      ],
      "lastSeen": "2026-09-05T16:52:38.561Z"
    },
    {
      "chain": "base",
      "address": "0x05199C088425d8C009839093c4D4Be4ECf37DA08",
      "owner": "org",
      "role": "auxiliary",
      "relations": [],
      "custody": {
        "kind": "env-on-host",
        "host": "bare-cedar-fog",
        "locator": "ANOTHER_WALLET",
        "reference": null,
        "derivationPath": "m/44'/60'/0'/0/9"
      },
      "custodies": [
        {
          "kind": "env-on-host",
          "host": "bare-cedar-fog",
          "locator": "ANOTHER_WALLET",
          "reference": null,
          "derivationPath": "m/44'/60'/0'/0/9"
        }
      ],
      "balanceReader": "@red-cup-engineering/treasury-observation-service/native",
      "label": null,
      "sources": [
        {
          "kind": "env-private-key",
          "locator": "ANOTHER_WALLET"
        }
      ],
      "lastSeen": "2026-09-05T16:52:38.561Z"
    },
    {
      "chain": "base",
      "address": "0x071C6a56C0FF7a9365137B3118eF03c179cE6768",
      "owner": "founder",
      "role": "auxiliary",
      "relations": [],
      "custody": {
        "kind": "env-on-host",
        "host": "bare-cedar-fog",
        "locator": "FOUND_ANOTHER_EVM_WALLET",
        "reference": null,
        "derivationPath": "m/44'/60'/0'/0/0"
      },
      "custodies": [
        {
          "kind": "env-on-host",
          "host": "bare-cedar-fog",
          "locator": "FOUND_ANOTHER_EVM_WALLET",
          "reference": null,
          "derivationPath": "m/44'/60'/0'/0/0"
        },
        {
          "kind": "unknown",
          "host": null,
          "locator": null,
          "reference": null,
          "derivationPath": null
        }
      ],
      "balanceReader": "@red-cup-engineering/treasury-observation-service/native",
      "label": null,
      "sources": [
        {
          "kind": "env-private-key",
          "locator": "FOUND_ANOTHER_EVM_WALLET"
        },
        {
          "kind": "carrier",
          "locator": "public-web3-services-section/services/agrodao/content/observations/public-accounts/evm-wallet-fleet.json (profile org.emsenn.evm.public-wallet-fleet.v1)"
        }
      ],
      "lastSeen": "2026-09-05T16:52:38.561Z"
    },
    {
      "chain": "base",
      "address": "0x0867eFBd9695Afbd3c557ca35Cf8137617A92a8b",
      "owner": "org",
      "role": "auxiliary",
      "relations": [],
      "custody": {
        "kind": "env-on-host",
        "host": "bare-cedar-fog",
        "locator": "GOSH_WOULDNT_YOU_KNOW_IT_ANOTHER_EVM_WALLET",
        "reference": null,
        "derivationPath": "m/44'/60'/0'/0/9"
      },
      "custodies": [
        {
          "kind": "env-on-host",
          "host": "bare-cedar-fog",
          "locator": "GOSH_WOULDNT_YOU_KNOW_IT_ANOTHER_EVM_WALLET",
          "reference": null,
          "derivationPath": "m/44'/60'/0'/0/9"
        }
      ],
      "balanceReader": "@red-cup-engineering/treasury-observation-service/native",
      "label": null,
      "sources": [
        {
          "kind": "env-private-key",
          "locator": "GOSH_WOULDNT_YOU_KNOW_IT_ANOTHER_EVM_WALLET"
        }
      ],
      "lastSeen": "2026-09-05T16:52:38.561Z"
    },
    {
      "chain": "base",
      "address": "0x0a53E3B2Ee6597B2885decab98579d2ee9879E02",
      "owner": "org",
      "role": "auxiliary",
      "relations": [],
      "custody": {
        "kind": "env-on-host",
        "host": "bare-cedar-fog",
        "locator": "VECHAIN",
        "reference": null,
        "derivationPath": "m/44'/60'/0'/0/3"
      },
      "custodies": [
        {
          "kind": "env-on-host",
          "host": "bare-cedar-fog",
          "locator": "VECHAIN",
          "reference": null,
          "derivationPath": "m/44'/60'/0'/0/3"
        }
      ],
      "balanceReader": "@red-cup-engineering/treasury-observation-service/native",
      "label": null,
      "sources": [
        {
          "kind": "env-private-key",
          "locator": "VECHAIN"
        }
      ],
      "lastSeen": "2026-09-05T16:52:38.561Z"
    },
    {
      "chain": "base",
      "address": "0x0c4A3B46cDC3b11a50F20f7D5e8D890C241c2215",
      "owner": "org",
      "role": "auxiliary",
      "relations": [],
      "custody": {
        "kind": "env-on-host",
        "host": "bare-cedar-fog",
        "locator": "ANOTHER_EVM_WALLET",
        "reference": null,
        "derivationPath": "m/44'/60'/0'/0/2"
      },
      "custodies": [
        {
          "kind": "env-on-host",
          "host": "bare-cedar-fog",
          "locator": "ANOTHER_EVM_WALLET",
          "reference": null,
          "derivationPath": "m/44'/60'/0'/0/2"
        },
        {
          "kind": "env-on-host",
          "host": "bare-cedar-fog",
          "locator": "OKX_WALLET",
          "reference": null,
          "derivationPath": "m/44'/60'/0'/0/2"
        }
      ],
      "balanceReader": "@red-cup-engineering/treasury-observation-service/native",
      "label": null,
      "sources": [
        {